{
  "$schema": "https://json-schema.org/draft/2020-12/schema",
  "$id": "https://github.com/immu4989/lurebench/spec/luremandate-otel-projection/v1",
  "title": "Independently recomputable OpenTelemetry-to-LureMandate projection v1",
  "type": "object",
  "additionalProperties": false,
  "required": ["schema", "schema_version", "generated_at", "implementation", "inputs", "run", "run_sha256", "clock_boundary", "privacy", "limitations"],
  "properties": {
    "schema": {"const": "https://github.com/immu4989/lurebench/spec/luremandate-otel-projection/v1"},
    "schema_version": {"const": 1},
    "generated_at": {"type": "string", "format": "date-time", "pattern": "^[0-9]{4}-[0-9]{2}-[0-9]{2}T(?:[01][0-9]|2[0-3]):[0-5][0-9]:[0-5][0-9](?:[.][0-9]{1,6})?(?:Z|[+-](?:[01][0-9]|2[0-3]):[0-5][0-9])$"},
    "implementation": {"type": "object", "additionalProperties": false, "required": ["name", "version"], "properties": {"name": {"const": "lurebench"}, "version": {"$ref": "#/$defs/id"}}},
    "inputs": {
      "type": "object", "additionalProperties": false,
      "required": ["mandate_plan", "mandate_plan_sha256", "otel_log_export", "otel_log_export_sha256"],
      "properties": {
        "mandate_plan": {"$ref": "https://github.com/immu4989/lurebench/spec/luremandate-plan-v1"},
        "mandate_plan_sha256": {"$ref": "#/$defs/digest"},
        "otel_log_export": {"$ref": "https://github.com/immu4989/lurebench/spec/luremandate-otel-log-export/v1"},
        "otel_log_export_sha256": {"$ref": "#/$defs/digest"}
      }
    },
    "run": {"$ref": "https://github.com/immu4989/lurebench/spec/luremandate-run-v1"},
    "run_sha256": {"$ref": "#/$defs/digest"},
    "clock_boundary": {"const": {"benchmark_time_field": "Timestamp", "collector_time_field": "ObservedTimestamp", "observed_timestamp_used_for_benchmark_timing": false, "timestamp_resolution": "microsecond_aligned_unix_nanoseconds", "event_timestamp_binding": "exact_declared_luremandate_lifecycle_time", "external_clock_assurance_required": true}},
    "privacy": {"const": {"body_accepted": false, "instrumentation_scope_accepted": false, "free_text_or_transaction_content_accepted": false, "tokens_credentials_prompts_commands_payloads_hosts_urls_or_customer_content_accepted": false, "opaque_identifiers_spiffe_ids_digests_decisions_and_bounded_impact_units_only": true}},
    "limitations": {"const": ["projection_rejects_log_body_unknown_attributes_free_text_prompts_commands_payloads_credentials_hosts_urls_and_customer_content", "benchmark_timing_uses_origin_clock_timestamp_not_collector_observed_timestamp", "each_transaction_requires_one_trace_with_exact_intent_decision_outcome_and_approval_coverage", "trace_context_correlates_records_but_does_not_authenticate_or_prove_causality", "projection_does_not_prove_telemetry_completeness_clock_sync_delivery_approver_identity_or_enforcement", "projection_is_not_otlp_or_opentelemetry_semantic_conventions_conformance"]}
  },
  "$defs": {
    "id": {"type": "string", "minLength": 1, "maxLength": 96, "pattern": "^[a-z0-9]+(?:[a-z0-9._-]*[a-z0-9])?$"},
    "digest": {"type": "string", "pattern": "^[a-f0-9]{64}$"}
  }
}
